"10.2307/1571673","The Native Cultures of the Southern Continent: An Attempted Triangulation","Robert L. Carneiro, David J. Wilson, ","11",1,"","2000-01-01T00:00:00Z","89-92",""
"10.1017/S0956536115000152","ATM volume 26 issue 1 Cover and Front matter","","26",1,"","2015-01-01T00:00:00Z","f1-f2",""
"10.1017/S1045663500003138","How (Good) Was It to Be the King? Current Research on the Archaeology of Palaces in Ancient America","Peter Eeckhout, Susan Toby Evans, Joanne Pillsbury, Jessica Joyce Christie, Patrica Joan Sarro, ","21",4,"","2010-01-01T00:00:00Z","459-466",""
"10.1017/S104566350001258X","Editor's Corner","Katharina J. Schreiber, ","10",3,"","1999-01-01T00:00:00Z","207-208",""
"10.2307/25063104","Defensibility and Settlement Patterns in the Guatemalan Maya Highlands","Greg Borgstede, James R. Mathieu, ","18",2,"","2007-01-01T00:00:00Z","191-211",""
"10.1017/S0956536116000171","ATM volume 27 issue 1 Cover and Back matter","","27",1,"","2016-01-01T00:00:00Z","b1-b2",""
"10.1017/S0956536100000766","The Ceramic Sequence at Nakbe, Guatemala","Donald W. Forsyth, ","4",1,"","1993-01-01T00:00:00Z","31-53",""
"10.7183/1045-6635.27.4.512","El Cuy (","Mara Fernanda Martnez-Polanco, ","27",4,"","2016-01-01T00:00:00Z","512-526",""
"10.1017/laq.2017.28","COPING WITH CONFLICT: DEFENSIVE STRATEGIES AND CHRONIC WARFARE IN THE PREHISPANIC NAZCA REGION","Weston C. McCool, ","28",3,"","2017-01-01T00:00:00Z","373-393",""
"10.2307/971724","","Arnold, Thomas H. Guderjan, ","3",3,"","1992-01-01T00:00:00Z","257-258",""
"10.2307/972257","","Lisa J. Lucero, Traci Arden, ","14",1,"","2003-01-01T00:00:00Z","107-108",""
"10.2307/972062","","Dan M. Healan, Robert H. Cobean, Alba Guadalupe Mastache, ","12",2,"","2001-01-01T00:00:00Z","223-225",""
"10.1017/S0956536100001462","Teotihuacan Valley, Mexico, Postclassic Chronology","Susan Toby Evans, AnnCorinne Freter, ","7",2,"","1996-01-01T00:00:00Z","267-280",""
"10.7183/1045-6635.24.1.116","","Mark Aldenderfer, Tom D. Dillehay, ","24",1,"","2013-01-01T00:00:00Z","116-117",""
"10.7183/1045-6635.22.2.143","People Who Lived in Stone Houses: Local Knowledge and Social Difference in the Classic Maya Puuc Region of Yucatan, Mexico","Kelli Carmean,  Patricia A. McAnany, Jeremy A. Sabloff, ","22",2,"","2011-01-01T00:00:00Z","143-158",""
"10.1017/S0956536111000204","INTRODUCTION: MAYA ARCHAEOLOGY AND SOCIAL MEMORY","William R. Fowler, Greg Borgstede, Charles W. Golden, ","21",2,"","2011-01-01T00:00:00Z","309-313",""
"10.2307/972172","Maya Diets of the Rich and Poor: Paleoethnobotanical Evidence from Copan","David L. Lentz, ","2",3,"","1991-01-01T00:00:00Z","269-287",""
"10.2307/971605","","Marilyn P. Beaudry-Corbett, Frederick J. Bove, Sonia Medrano B., Brenda Lou P., Barbara Arroyo L., ","6",1,"","1995-01-01T00:00:00Z","89-90",""
"10.1017/S1045663500016382","","Nancy Gonlin, Sarah Kurnick, Joanne Baron, ","27",4,"","2016-01-01T00:00:00Z","567-568",""
"10.2307/25063084","Formative and Classic Period Obsidian Procurement in Central Mexico: A Compositional Study Using Laser Ablation-Inductively Coupled Plasma-Mass Spectrometry","David M. Carballo,  Jennifer Carballo, Hector Neff, ","18",1,"","2007-01-01T00:00:00Z","27-43",""
"10.1017/S1045663500009974","LAQ volume 12 issue 4 Cover and Back matter","","12",4,"","2001-01-01T00:00:00Z","b1-b3",""

"10.2307/3557603","","Thomas H. Charlton, Florence C. Lister, Robert H. Lister, ","14",2,"","2003-01-01T00:00:00Z","239-239",""
"10.2307/971694","","Kenneth G. Hirth, Laura Finsten, ","8",2,"","1997-01-01T00:00:00Z","159-160",""
"10.1017/S095653611800007X","SOLAR OBSERVATORY OR ALLEGORY? CALAKMUL'S GROUP E-TYPE COMPLEX FORM AND FUNCTION  ERRATUM","","29",1,"","2018-01-01T00:00:00Z","249-250",""
"10.1017/S0956536109990125","THEORIZING URBANISM IN ANCIENT MESOAMERICA","Arthur A. Joyce, ","20",2,"","2009-01-01T00:00:00Z","189-196",""
"10.7183/1045-6635.22.4.403","The Art of Becoming: The Graffiti of Tikal, Guatemala","Scott R. Hutson, ","22",4,"","2011-01-01T00:00:00Z","403-426",""
"10.1017/S1045663500008373","LAQ volume 2 issue 2 Cover and Front matter","","2",2,"","1991-01-01T00:00:00Z","f1-f4",""
"10.1017/S1045663500004429","LAQ volume 24 issue 1 Cover and Front matter","","24",1,"","2013-01-01T00:00:00Z","f1-f4",""
"10.1017.S0956536102131105","CLIMATE-CHANGE STUDIES IN THE MAYA AREAA diachronic 
analysis","Joel D.
Gunn,Ray T.
Matheny,William J.
Folan,","13",1,"","2002-01-01T00:00:00Z","79-84",""
"10.1017/laq.2017.66","","Christina A. Conlee, ","29",1,"","2017-01-01T00:00:00Z","191-192",""
"10.2307/3537011","Trace-Element Analysis of Obsidian Sources and Artifacts of Central Chile (Maule River Basin) and Western Argentina (Colorado River)","Andrea Seelenfreund, Charles Rees, Roger Bird, Graham Bailey, Roberto Brcena, Victor Durn, ","7",1,"","1996-01-01T00:00:00Z","7-20",""
"10.1017/S0956536100001966","An Early Classic Center in the Puuc Region","Michael P. Smyth, Jos Ligorred Perramon, David Ortegn Zapata, Pat Farrell, ","9",2,"","1998-01-01T00:00:00Z","233-257",""
"10.1017/S0956536111000253","THREAD PRODUCTION IN EARLY POSTCLASSIC COASTAL OAXACA, MEXICO: TECHNOLOGY, INTENSITY, AND GENDER","Stacie M. King, ","22",2,"","2011-01-01T00:00:00Z","323-343",""
"10.7183/1045-6635.21.2.115","Cerro Lampay: Architectural Design and Human Interaction in the North Central Coast of Peru","Rafael Vega-Centeno, ","21",2,"","2010-01-01T00:00:00Z","115-145",""
"10.2307/971813","Demographic and Architectural Retrodiction: An Ethnoarchaeological Case Study in the South American Tropical Lowlands","Peter E. Siegel, ","1",4,"","1990-01-01T00:00:00Z","319-346",""
"10.1017/S104566350000794X","Piedras Negras and Yaxchilan: Divergent Political Trajectories in Adjacent Maya Polities","Charles Golden, Andrew K. Scherer, A. Ren Muoz, Rosaura Vasquez, ","19",3,"","2008-01-01T00:00:00Z","249-274",""
"10.7183/1045-6635.21.4.441","Uso de plantas psicoactivas en el norte de chile: evidencia qumica del consumo de ayahuasca durante el Periodo Medio (5001000 d.C.)","Juan P. Ogalde, Bernardo T. Arriaza, Elia C. Soto, ","21",4,"","2010-01-01T00:00:00Z","441-450",""
"10.2307/972153","","William H. Isbell, Marc Bermann, ","6",2,"","1995-01-01T00:00:00Z","184-186",""
"10.1017/S0956536116000274","VENUS LORE IN THE POSTCLASSIC MAYA CODICES: DEITY MANIFESTATIONS OF THE MORNING AND EVENING STAR","Gabrielle Vail, ","28",2,"","2017-01-01T00:00:00Z","475-488",""
"10.1017/S095653610000033X","Structure and Change in a Late Classic Maya Domestic Group at Copan, Honduras","James J. Sheehy, ","2",1,"","1991-01-01T00:00:00Z","1-20",""
"10.1017/S0956536108000291","METALLURGY, MAYAPAN, AND THE POSTCLASSIC MESOAMERICAN WORLD SYSTEM","Elizabeth H. Paris, ","19",1,"","2008-01-01T00:00:00Z","43-66",""
"10.1017/S0956536111000101","SHIFTING PATTERNS OF OBSIDIAN EXCHANGE IN POSTCLASSIC OAXACA, MEXICO","Marc N. Levine, Arthur A. Joyce, Michael D. Glascock, ","22",1,"","2011-01-01T00:00:00Z","123-133",""
"10.1017/S0956536113000023","IMPACTS OF POLITICS ON MATERIAL CULTURE: EVALUATING THE YAXUNA-COBA ","Tatiana Loya Gonzlez, Travis W. Stanton, ","24",1,"","2013-01-01T00:00:00Z","25-42",""
"10.7183/1045-6635.23.2.144","Bone Chemistry at Cerro Oreja: A Stable Isotope Perspective on the Development of a Regional Economy in the Moche Valley, Peru During the Early Intermediate Period","Patricia M. Lambert, Celeste Marie Gagnon, Brian R. Billman, M. Anne Katzenberg, Jos Carceln, Robert H. Tykot, ","23",2,"","2012-01-01T00:00:00Z","144-166",""
"10.1017/S0956536116000018","THE ETHNOHISTORY AND ARCHAEOLOGY OF CUAUHQUECHOLLAN, VALLEY OF ATLIXCO, MEXICO - ERRATUM","","27",1,"","2016-01-01T00:00:00Z","231-231",""
"10.1017/S0956536110000283","RITUAL REMAINS AND COLLECTIVE MEMORY: MAYA EXAMPLES FROM WEST CENTRAL BELIZE","Sonja A. Schwake, Gyles Iannone, ","21",2,"","2011-01-01T00:00:00Z","331-339",""
"10.1017/S0956536111000228","ATM volume 22 issue 1 Cover and Back matter","","22",1,"","2011-01-01T00:00:00Z","b1-b3",""
"10.1017/S095653611400011X","OUT OF CONTROL? RETHINKING ASSUMPTIONS ABOUT WEALTH GOODS PRODUCTION AND THE CLASSIC MAYA","Erick T. Rochette, ","25",1,"","2014-01-01T00:00:00Z","165-185",""
"10.2307/4141590","","Alan R. Sandstrom, Peter T. Furst, ","15",4,"","2004-01-01T00:00:00Z","460-461",""
"10.1017/S0956536100002327","Late Classic Architectural Sculpture Themes in Copan","Barbara W. Fash, ","3",1,"","1992-01-01T00:00:00Z","89-104",""
"10.2307/971560","Arqueologia de la Cuenca del Qaracha, Ayacucho, Peru","Lidio M. Valdez, Cirilo Vivanco, ","5",2,"","1994-01-01T00:00:00Z","144-157",""
"10.2307/25478183","A Microscopic View of Ceramic Production: An Analysis of Thin-Sections from Monte Albn","Lane F. Fargher, ","18",3,"","2007-01-01T00:00:00Z","313-332",""
"10.1017/S0956536116000389","SALVAGING RECURRING THEMES OF HISTORICAL MEMORY IN THE COHUIXCA PROVINCE OF TEPECOACUILCO (COHUIXCATLACAPAN), GUERRERO, MEXICO, 1460 TO 1580","Amos Megged, ","28",2,"","2017-01-01T00:00:00Z","383-401",""
"10.2307/25063088","Noble Savages Versus Savage Nobles: Gibsons Apocalyptic View of the Maya","James J. Aimers, Elizabeth Graham, Mel Gibson, ","18",1,"","2007-01-01T00:00:00Z","105-106",""
"10.1017/S0956536108000229","FIBER TECHNOLOGY AND WEAVING IN FORMATIVE-PERIOD GULF COAST CULTURES","Billie J. A. Follensbee, ","19",1,"","2008-01-01T00:00:00Z","87-110",""
"10.1017/S0956536114000182","ATM volume 25 issue 1 Cover and Back matter","","25",1,"","2014-01-01T00:00:00Z","b1-b2",""
"10.1017/S1045663500015078","LAQ volume 14 issue 3 Cover and Back matter","","14",3,"","2003-01-01T00:00:00Z","b1-b3",""
"10.1017/S0956536102132093","CLIMATIC AND ENVIRONMENTAL VARIABILITY IN THE RISE OF MAYA 
CIVILIZATION: A preliminary perspective from northern Peten","Richard D.
Hansen,Steven
Bozarth,John
Jacob,David
Wahl,Thomas
Schreiner,","13",2,"","2002-01-01T00:00:00Z","273-295",""
"10.2307/971978","","Nancy Forand, Didier Boremanse, ","10",4,"","1999-01-01T00:00:00Z","445-446",""
"10.1017/S1045663500007045","LAQ volume 18 issue 1 Cover and Back matter","","18",1,"","2007-01-01T00:00:00Z","b1-b3",""
"10.2307/971870","","David F. Mora-Marn, Victoria Bricker, ","11",2,"","2000-01-01T00:00:00Z","211-212",""
"10.2307/971774","","Donald E. McVicker, Herbert J. Spinden, Bruce E. Byland, ","12",1,"","2001-01-01T00:00:00Z","122-122",""
"10.1017/S1045663500008099","","Michael D. Coe, Joseph Mountjoy, ","26",2,"","2015-01-01T00:00:00Z","280-281",""
"10.2307/971930","Analisis Quimico de Pisos de Ocupacion: Un Caso Etnografico en Tlaxcala, Mexico","Luis Barba, Agustn Ortiz, ","3",1,"","1992-01-01T00:00:00Z","63-82",""
"10.1017/laq.2017.64","INTERREGIONAL OBSIDIAN EXCHANGE DURING THE LATE INITIAL PERIOD AND EARLY HORIZON: NEW PERSPECTIVES FROM CAMPANAYUQ RUMI, PERU","Yuichi Matsumoto, Jason Nesbitt, Michael D. Glascock, Yuri I. Cavero Palomino, Richard L. Burger, ","29",1,"","2017-01-01T00:00:00Z","44-63",""
"10.1017/laq.2018.28","PRCTICAS ALFARERAS PREHISPNICAS Y PROCESOS DE INTERACCIN SOCIAL EN EL CENTRO-ESTE DE ARGENTINA DURANTE EL HOLOCENO TARDO","Violeta Di Prado, ","29",3,"","2018-01-01T00:00:00Z","552-571",""
"10.1017.S0956536102131129","LOS MAYAS Y EL NIOPaleoclimatic correlations, 
environmental dynamics, and cultural implications for the ancient 
Maya","Lewis C.
Messenger
Jr.,","13",1,"","2002-01-01T00:00:00Z","159-170",""
"10.1017/laq.2017.70","KAMINALJUYU CHRONOLOGY AND CERAMIC ANALYSIS: AN ALTERNATIVE VIEW","Michael Love, ","29",2,"","2017-01-01T00:00:00Z","260-278",""
"10.1017/S1045663500004405","","Lilia Fernndez Souza, Jennifer P. Mathews, Bethany A. Morrison, ","19",4,"","2008-01-01T00:00:00Z","476-477",""
"10.1017/S1045663500001607","LAQ volume 22 issue 1 Cover and Front matter","","22",1,"","2011-01-01T00:00:00Z","f1-f4",""
"10.1017/S0956536111000290","OBJECT, MEMORY, AND MATERIALITY AT YAXCHILAN: THE RESET LINTELS OF STRUCTURES 12 AND 22","Megan E. O'Neil, ","22",2,"","2011-01-01T00:00:00Z","245-269",""
"10.1017/S0956536114000194","ATM volume 25 issue 1 Cover and Front matter","","25",1,"","2014-01-01T00:00:00Z","f1-f2",""
"10.2307/971739","Imperial and Social Relations in Postclassic South-Central Veracruz, Mexico","Christopher P. Garraty, Barbara L. Stark, ","13",1,"","2002-01-01T00:00:00Z","3-33",""
"10.1017/S1045663500016357","","Chlo Andrieu, Eleanor M. King, ","27",4,"","2016-01-01T00:00:00Z","563-564",""
"10.1017/S1045663500002601","Book Review Essay","David Cheetham, Richard A.  Diehl, Christopher A. Pool, ","20",1,"","2009-01-01T00:00:00Z","260-263",""
"10.1017/S095653611500005X","THE ROOTS OF SOTUTA: DZITAS SLATE AS A YUCATECAN TRADITION","Scott A. J. Johnson, ","26",1,"","2015-01-01T00:00:00Z","113-126",""
"10.1017/S104566350000434X","Human Sacrifice at Pachacamac","Peter Eeckhout, Lawrence Stewart Owens, ","19",4,"","2008-01-01T00:00:00Z","375-398",""
"10.2307/30042495","The Utilization of Grooved Human Bones: A Reanalysis of Artificially Modified Human Bones Excavated by Carl Lumholtz at Zacapu, Michoacn, Mexico","Grgory Pereira, ","16",3,"","2005-01-01T00:00:00Z","293-312",""
"10.2307/971794","","Dean E. Arnold, Arnold, ","4",3,"","1993-01-01T00:00:00Z","297-299",""
"10.1017/S0956536116000262","UNDERSTANDING THE WRAPPED BUNDLE BURIALS OF WEST MEXICO: A CONTEXTUAL ANALYSIS OF MIDDLE FORMATIVE MORTUARY PRACTICES","Jill A. Rhodes, Joseph B. Mountjoy, Fabio G. Cupul-Magaa, ","27",2,"","2016-01-01T00:00:00Z","377-388",""
"10.7183/1045-6635.21.4.423","Formative Adaptations, Diet, and Oral Health in the Azapa Valley of Northwest Chile","James T. Watson, Ivn Muoz Ovalle, Bernardo T. Arriaza, ","21",4,"","2010-01-01T00:00:00Z","423-439",""
"10.2307/972139","","Winifred Creamer, David Hurst Thomas, ","4",1,"","1993-01-01T00:00:00Z","94-95",""
"10.7183/1045-6635.21.2.217","The Arawak Diaspora","Peter W. Stahl, Jonathan D. Hill, Fernando Santosgranero, Michael J. Heckenberger, Irving Rouse, ","21",2,"","2010-01-01T00:00:00Z","217-223",""
"10.1017/S1045663500017004","Erratum","","26",2,"","2015-01-01T00:00:00Z","284-284",""
"10.1017/laq.2017.48","PERROS PREHISTRICOS EN EL ESTE DE URUGUAY: CONTEXTOS E IMPLICACIONES CULTURALES","Jos M. Lpez Mazz, Federica Moreno, Roberto Bracco, Roberto Gonzlez, ","29",1,"","2017-01-01T00:00:00Z","64-78",""
"10.2307/971644","","Grant Jones, ","12",3,"","2001-01-01T00:00:00Z","342-343",""
"10.1017/S0956536110000295","SITES OF MEMORY IN THE MAKING: POLITICAL STRATEGIZING IN THE CONSTRUCTION AND DECONSTRUCTION OF PLACE IN LATE TO TERMINAL CLASSIC SOUTHEASTERN MESOAMERICA","Miranda Stockett, ","21",2,"","2011-01-01T00:00:00Z","315-330",""
"10.1017/S0956536100000249","The INAH Salvage Archaeology Excavations at Azcapotzalco, Mexico: An Analysis of the Lithic Assemblage","Raul Garca Chvez, Michael D. Glascock, J. Michael Elam, Harry B. lceland, ","1",2,"","1990-01-01T00:00:00Z","225-232",""
"10.1017/S0956536113000035","CERRO PORTEZUELO: STATES AND HINTERLANDS IN THE PRE-HISPANIC BASIN OF MEXICO","Deborah L. Nichols, Hector Neff, George L. Cowgill, ","24",1,"","2013-01-01T00:00:00Z","47-71",""
"10.2307/972169","Site-Planning Principles and Concepts of Directionality among the Ancient Maya","Wendy Ashmore, ","2",3,"","1991-01-01T00:00:00Z","199-226",""
"10.1017/laq.2017.31","","Cecelia F. Klein, ","28",4,"","2017-01-01T00:00:00Z","624-625",""
"10.7183/1045-6635.27.4.462","From Tula Chico to Chichn Itz: Implications of the Epiclassic Sculpture of Tula for the Nature and Timing of Tula-Chichn Contact","Keith Jordan, ","27",4,"","2016-01-01T00:00:00Z","462-478",""
"10.2307/972270","","Jean-Pierre Protzen, Nelly M. Robles Garcia, ","7",4,"","1996-01-01T00:00:00Z","380-380",""
"10.1017/S0956536114000340","ATM volume 25 issue 2 Cover and Front matter","","25",2,"","2015-01-01T00:00:00Z","f1-f2",""
"10.1017/S1045663500014917","LAQ volume 14 issue 2 Cover and Front matter","","14",2,"","2003-01-01T00:00:00Z","f1-f4",""
"10.2307/3557576","The Exemplary Center of the Late Postclassic Kowoj Maya","Timothy W. Pugh, ","14",4,"","2003-01-01T00:00:00Z","408-430",""
"10.2307/1571674","","Frank Salomon, Susan Kellogg, Matthew Restall, ","11",1,"","2000-01-01T00:00:00Z","92-93",""
"10.1017/laq.2017.46","LOOKING AT A MAP MIGHT HELP: A COMMENT ON BURGER ET AL., ECUADORIAN CINNABAR AND THE PREHISPANIC TRADE IN VERMILION PIGMENT: VIABLE HYPOTHESIS OR RED HERRING?","Karen Olsen Bruhns, William E. Brooks, Deborah Truhan, ","28",4,"","2017-01-01T00:00:00Z","609-610",""
"","INTRODUCTION","William R.
Fowler
Jr.,","12",1,"","2001-01-01T00:00:00Z","87-87",""
"10.2307/971923","","Randall McGuire, Michael S. Foster, Shirley Gorenstein, ","13",2,"","2002-01-01T00:00:00Z","245-247",""
"10.1017/S0956536100001280","Ancient Maya Trading Ports and the Integration of Long-Distance and Regional Economies: Wild Cane Cay in South-Coastal Belize","Heather McKillop, ","7",1,"","1996-01-01T00:00:00Z","49-62",""
"10.2307/972118","","Catherine Liot, Susana Ramrez Urrea, Eduardo Williams, Phil C. Weigand, ","13",3,"","2002-01-01T00:00:00Z","361-363",""
"10.2307/972157","","Peter D. Harrison, Jeremy A. Sabloff, John S. Henderson, ","6",2,"","1995-01-01T00:00:00Z","191-192",""
"10.2307/971614","Symbolic Sweatbaths of the Maya: Architectural Meaning in the Cross Group at Palenque, Mexico","Stephen D. Houston, ","7",2,"","1996-01-01T00:00:00Z","132-151",""
"10.1017/S0956536116000286","STELA D: A SUNDIAL AT COPAN, HONDURAS","Mara C. Pineda de Caras, Nohemy L. Rivera, Cristina M. Argueta, ","28",2,"","2017-01-01T00:00:00Z","543-557",""
"10.2307/972108","More on the Mars Table in the Dresden Codex","Harvey M. Bricker, Victoria R. Bricker, ","8",4,"","1997-01-01T00:00:00Z","384-397",""
"10.1017/S0956536117000104","ATM volume 28 issue 1 Cover and Front matter","","28",1,"","2017-01-01T00:00:00Z","f1-f2",""
"10.2307/971861","","John W. Hoopes, Michael Blake, ","11",2,"","2000-01-01T00:00:00Z","200-201",""
"10.1017.S0956536102131026","SPIRALS, ROPES, AND FEATHERSThe iconography of rubber 
balls in Mesoamerican art","Andrea J.
Stone,","13",1,"","2002-01-01T00:00:00Z","21-39",""
"10.1017/S1045663500012827","LAQ volume 10 issue 4 Cover and Back matter","","10",4,"","1999-01-01T00:00:00Z","b1-b5",""
"10.1017/S1045663500006921","","Gabriel Ramn Joffr, Nicholas Tripcevich, Kevin J. Vaughn, ","26",1,"","2015-01-01T00:00:00Z","139-140",""
"10.7183/1045-6635.23.2.229","Review","Arnold, ","23",2,"","2012-01-01T00:00:00Z","229-229",""
"10.1017/S0956536100001516","ATM volume 8 issue 1 Cover and Front matter","","8",1,"","1997-01-01T00:00:00Z","f1-f2",""
"10.1017/S0956536110000271","THE MYSTERIOUS AND THE INVISIBLE: WRITING HISTORY IN AND OF COLONIAL YUCATAN","Matthew Restall, ","21",2,"","2011-01-01T00:00:00Z","393-400",""
"10.1017/S0956536100001668","Monkey Business at Northern River Lagoon: A coastalInland Interaction Sphere in Northern Belize","Shirley Boteler Mock, ","8",2,"","1997-01-01T00:00:00Z","165-183",""
"10.1017/S0956536100000079","Maize Storage among the Puuc Maya: The Development of an Archaeological Method","Michael P. Smyth, ","1",1,"","1990-01-01T00:00:00Z","51-69",""
"10.1017/laq.2018.1","EMBODIED SIGNS: READING GESTURE AND POSTURE IN CLASSIC MAYA DANCE","Mark Wright, Justine Lemos, ","29",2,"","2018-01-01T00:00:00Z","368-385",""
"10.1017/S0956536113000205","SERPENTS, SKELETONS, AND ANCESTORS?: THE TULA COATEPANTLI REVISITED","Keith Jordan, ","24",2,"","2014-01-01T00:00:00Z","243-274",""
"10.2307/971580","","Ramiro Matos Mendieta, Krzysztof Makowski, Christopher Donnan, Ivan Amaro Bullon, Luis Jaime Castillo, Magdalena Diez Canseco, Otto Elespuro Revoredo, Juan Antonio Murro Mena, ","7",3,"","1996-01-01T00:00:00Z","280-281",""
"10.2307/971946","","Anthony P. Andrews, David M. Pendergast, ","3",2,"","1992-01-01T00:00:00Z","179-180",""
"10.1017/S0956536114000170","PRODUCCIONES PALACIEGAS TENOCHCAS EN OBJETOS DE CONCHA Y LAPIDARIA","Adrin Velzquez Castro, Emiliano Ricardo Melgar Tsoc, ","25",1,"","2014-01-01T00:00:00Z","295-308",""
"10.2307/971854","A Classic Maya House-Lot Drainage System in Northwestern Belize","Jon C. Lohse, Patrick N. Findlay, ","11",2,"","2000-01-01T00:00:00Z","175-185",""
"10.1017/S0956536112000168","FIGURINES ARE US? THE SOCIAL ORGANIZATION OF JAINA ISLAND, CAMPECHE, MEXICO","Donald McVicker, ","23",2,"","2012-01-01T00:00:00Z","211-234",""
"10.1017/laq.2018.27","LAS OCUPACIONES HUMANAS EN LA LOCALIDAD ARQUEOLGICA LAGUNA DE LOS PAMPAS (CAMPO DE DUNAS DEL CENTRO PAMPEANO, ARGENTINA) DURANTE EL HOLOCENO","Pablo G. Messineo, Mariela E. Gonzlez, Mara C. lvarez, Nlida Pal, ","29",4,"","2018-01-01T00:00:00Z","736-753",""
"10.1017/S0956536117000153","CYCLES OF DEATH AND REBIRTH IN MESOAMERICAN CULTURAL ASTRONOMY AND THE CALENDAR","Anne S. Dowd, ","28",2,"","2017-01-01T00:00:00Z","465-473",""
"10.2307/3537035","","Laura Finsten, Charles S. Spencer, Elsa M. Redmond, ","9",4,"","1998-01-01T00:00:00Z","371-372",""
"10.1017/S0956536115000358","FEATHERWORKING IN THE PROVINCES: A DISPERSED LUXURY CRAFT UNDER AZTEC HEGEMONY","Frances F. Berdan, ","27",1,"","2016-01-01T00:00:00Z","209-219",""
"","FLOOD REPTILES, SERPENT TEMPLES, AND THE QUADRIPARTITE 
UNIVERSEThe Imago Mundi of Late Postclassic Mayapan","Timothy W.
Pugh,","12",2,"","2001-01-01T00:00:00Z","247-258",""
"10.7183/1045-6635.21.1.3","A Mito-Style Structure at Chavn De Huntar: Dating and Implications","Daniel A. Contreras, ","21",1,"","2010-01-01T00:00:00Z","3-21",""
"10.1017/S0956536100001541","Gender and Health Among the Colonial Maya of Tipu, Belize","Marie Elaine Danforth, Keith P. Jacobi, Mark Nathan Cohen, ","8",1,"","1997-01-01T00:00:00Z","13-22",""
"10.1017/S095653610000095X","Expanding the Role of Trace-Element Studies: Obsidian Use in the Late and Terminal Classic Periods at the Lowland Maya Site of Colha, Belize","Meredith L. Dreiss, David O. Brown, Thomas R. Hester, Michael D. Glascock, ","4",2,"","1993-01-01T00:00:00Z","271-283",""
"10.2307/25063047","Preceramic Occupations in Belize: Updating the Paleoindian and Archaic Record","Jon C. Lohse, Jaime Awe, Cameron Griffith, Robert M. Rosenswig, Valdez, ","17",2,"","2006-01-01T00:00:00Z","209-226",""
"10.1017/laq.2018.33","","Claudia Brittenham, ","29",3,"","2018-01-01T00:00:00Z","627-628",""
"10.2307/971681","","William R. Fowler, Mark Miller Graham, ","6",3,"","1995-01-01T00:00:00Z","285-286",""
"10.2307/971574","Tiwanaku Settlement System: The Integration of Nested Hierarchies in the Lower Tiwanaku Valley","Juan Albarracin-Jordan, ","7",3,"","1996-01-01T00:00:00Z","183-210",""
"10.1017/S0956536100000080","New Data on Sources of Obsidian Artifacts from Tikal, Guatemala","Hattula Moholy-Nagy, Fred W. Nelson, ","1",1,"","1990-01-01T00:00:00Z","71-80",""
"10.7183/1045-6635.22.4.487","North and South: Hunter-Gatherer Communities in the Andes Mountains in Central Chile","Luis E. Cornejo B., Lorena Sanhueza R., ","22",4,"","2011-01-01T00:00:00Z","487-504",""
"10.2307/971579","","Susan A. Niles, Ramiro Matos Mendieta, ","7",3,"","1996-01-01T00:00:00Z","279-280",""
"10.2307/971956","","Johan Reinhard, Duccio Bonavia, ","3",4,"","1992-01-01T00:00:00Z","368-369",""
"10.2307/971836","House of the Sun: The Inka Temple of Vilcanota","Johan Reinhard, ","6",4,"","1995-01-01T00:00:00Z","340-349",""
"10.1017/laq.2018.26","PLAZAS AND PROCESSIONAL PATHS IN TIWANAKU TEMPLES: DIVERGENCE, CONVERGENCE, AND ENCOUNTER AT OMO M10, MOQUEGUA, PERU","Paul S. Goldstein, Matthew J. Sitek, ","29",3,"","2018-01-01T00:00:00Z","455-474",""
"10.2307/25063115","","Paul F. Healy, L. Antonio Curet, Shannon Lee Dawdy, Gabino La Rosa Corzo, ","18",2,"","2007-01-01T00:00:00Z","236-239",""
"10.1017/S0956536105050133","AGENCY AND THE STAR WAR GLYPH: A historical 
reassessment of Classic Maya astrology and warfare","Gerardo
Aldana


Aldana G,Aldana, Gerardo,Aldana, Gerardo,Aldana, Gerardo,Aldana, Gerardo,Aveni, Anthony F.,Aveni, Anthony F.,Aveni, Anthony F.,Aveni, Anthony F.,Aveni, Anthony F.,Lorren Hotaling,Barrera Vsquez, Alfredo
(director),Bielenstein, Hans,Bielenstein, Hans,Closs, Michael,Closs, Michael,Closs, Michael,Closs, Michael,Anthony F. Aveni,Bruce Crowley,Coe, Michael,Coe, Michael,Dtting, Dieter,Mathias Schramm,Fox, James A.,John S. Justeson,Freidel, David,Linda Schele,Joy Parker,Grube, Nikolai,Grube, Nikolai,Hotaling, Lorren,Houston, Stephen,Houston, Stephen,David Stuart,Houston, Stephen,David Stuart,Justeson, John S.,Kelley, David,Kelley, David,Kelley, David,Lounsbury, Floyd,Lounsbury, Floyd,Martin, Simon,Mathews, Peter,Gordon R. Willey,Nahm, Werner,Sahagn, Bernardino de,Sandstrom, Alan,Schele, Linda,Schele, Linda,David Freidel,Schele, Linda,Nikolai Grube,Schele, Linda,Nikolai Grube,Schele, Linda,Nikolai Grube,Schele, Linda,Peter Mathews,Schele, Linda,Mary Miller,Simon, Rmi,Stuart, David S.,Stuart, David,Stephen Houston,John Robertson,Tate, Carolyn E.,Tedlock, Barbara,Tedlock, Dennis,Teeple, John,Thompson, J. Eric,Thompson, J. Eric,Velsquez, Primo Feliciano
(translator),Wisdom, Charles,","16",2,"","2005-01-01T00:00:00Z","305-320",""
"10.1017/S1045663500002923","LAQ volume 21 issue 1 Cover and Back matter","","21",1,"","2010-01-01T00:00:00Z","b1-b3",""
"10.2307/971799","Black-on-Orange Ceramic Production in the Aztec Empire's Heartland","Mary G. Hodge,  Hector Neff,  M. James Blackman, Leah D. Minc, ","4",2,"","1993-01-01T00:00:00Z","130-157",""
"","A MAYA CARVED SHELL PLAQUE FROM TULA, HIDALGO, 
MEXICOComparative study","Donald
McVicker,Joel W.
Palka,","12",2,"","2001-01-01T00:00:00Z","175-197",""
"10.1017/S0956536102132020","SALT PRODUCTION IN THE COASTAL AREA OF MICHOACAN, MEXICO: An 
ethnoarchaeological study","Eduardo
Williams,","13",2,"","2002-01-01T00:00:00Z","237-253",""
"10.2307/971757","El Desarrollo Cultural En El Valle De Azapa, Extremo Norte De Chile Y Su Vinculacin Con Los Desplazamientos Poblacionales Altiplnicos","Francisco Rothhammer, Calogero M. Santoro, ","12",1,"","2001-01-01T00:00:00Z","59-66",""
"10.1017/S0956536100001279","Environmental Degradation and the Classic Maya Collapse at Copan, Honduras (","Richard R. Paine, AnnCorinne Freter, ","7",1,"","1996-01-01T00:00:00Z","37-47",""
